{
  "plan_id": "plan-safari-navigate",
  "version": "1.0.0",
  "goal": "Navigate Safari to example.com",
  "app": "Safari",
  "steps": [
    {"step_id": "s1", "action": "launch", "params": {"app": "Safari"}},
    {"step_id": "s2", "action": "shortcut", "params": {"keys": ["command", "l"]}},
    {"step_id": "s3", "action": "type", "params": {"text": "https://example.com"}},
    {"step_id": "s4", "action": "shortcut", "params": {"keys": ["return"]}},
    {"step_id": "s5", "action": "wait", "params": {"seconds": 2}},
    {"step_id": "s6", "action": "assert", "params": {"condition": "url.contains(\"example.com\")"}}
  ]
}
