{
  "plan_id": "plan-finder-new-folder",
  "version": "1.0.0",
  "goal": "Create a new folder in Finder",
  "app": "Finder",
  "steps": [
    {"step_id": "s1", "action": "launch", "params": {"app": "Finder"}},
    {"step_id": "s2", "action": "shortcut", "params": {"keys": ["command", "shift", "n"]}},
    {"step_id": "s3", "action": "wait", "params": {"seconds": 0.5}},
    {"step_id": "s4", "action": "type", "params": {"text": "TestFolder"}},
    {"step_id": "s5", "action": "shortcut", "params": {"keys": ["return"]}},
    {"step_id": "s6", "action": "assert", "params": {"condition": "folder_exists(\"TestFolder\")"}}
  ]
}
